_u810_BioChemistry,bonding_chiral_glyceraldehyde_Chiral_centers_glyceraldehyde," The Jmol model below is of the carbohydrate glyceraldehyde _ What is the chirality of carbon 2 in this molecule? D Correct! The orientation of the four groups attached to carbon 2 of the Jmol glyceraldehyde is the mirror image of the orientation in l-glyceraldehyde shown on the left _ Rotate the molecule in Jmol to orient it in the same way as the L-glyceraldehyde figure on the left _ If you are having trouble, you can Click here script('moveto 1.0 -142 -449 882 86 80.00')to change the orientation _ Compare the groups coming off carbon 2."
_u810_BioChemistry,bonding_chiral_thr_Chiral_centers_thr," This Jmol model is of the amino acid Threonine _ This amino acid contains four carbons, labeled A, B, C, G _ Which of the following carbons are chiral? carbons A and B Correct! Threonine has two chiral centers, carbons A and B _ This gives four possible forms of Threonine - only one of which is found in proteins _ Chiral centers have four different atoms attached to the carbon."
_u810_BioChemistry,bonding_response_bonding_response_q1," How would you explain what happens to a salt crystal that remains in a non-polar solvent or a protein that finds itself buried in a sea of lipid? The salt crystal won’t dissolve because the non-polar solvent cannot interact favorably with the individual ions _ A water soluble protein, if found in a sea of lipid is likely to unfold because the non-polar residues that are in the core of the protein are no longer driven to the core by the hydrophobic effect; they are “solvated” by the non-polar part of the membrane _ "
_u810_BioChemistry,inline_bonding_only_q1,"Hydrophobic interactions are the major force forming lipid bilayers _ Correct _ When lipids are placed in water, they will spontaneously form micelles and bilayers to create local hydrophobic enviroments _ Look through the content of the page again."
_u810_BioChemistry,inline_bonding_only_q2,Hydrogen bonding is responsible for each of the following except the force holding hydrocarbons together _ Correct _ Hydrogen bonding only occurs when the hydrogen atom is attached to an electronegative atom _ Carbon is not electronegative _ The force holding hydrocarbons together is called the hydrophobic effect _ Look through the content of the page again.
_u810_BioChemistry,inline_bonding_only_q3,A covalent chemical bond is one in which outer shell electrons are shared by two atoms so as to satisfactorily fill the outer electron shells of both _ Correct _ Look through the content of the page again.
_u810_BioChemistry,a2_HS-AWB-01_bonding-02,"The underlying basis of hydrogen bonding is the unequal sharing of electrons by the strongly electronegative atoms O and N when they form covalent bonds, thus creating charge separation _ Correct."
_u810_BioChemistry,a2_HS-AWB-01_bonding-17,"What do the four elements most abundant in living systems - carbon, oxygen, hydrogen and nitrogen - have in common? They all have unpaired electrons in their valence shells _ Correct."
_u810_BioChemistry,a2_HS-AWB-01_bonding-15,The covalent bond is likely to be polar when one of the atoms sharing electrons is much more electronegative than the other atom Correct.
_u810_BioChemistry,a2_HS-AWB-01_bonding-14,Nitrogen (N) is much more electronegative than hydrogen (H) _ Which of the following statements is CORRECT about ammonia (NH3)? Each hydrogen atom has a partial positive charge Correct.
_u810_BioChemistry,a2_HS-AWB-01_bonding-13,Hydrophobic interactions are the major force forming lipid (hydrocarbon) bilayers Correct.
_u810_BioChemistry,a2_HS-AWB-01_bonding-12,Hydrogen bonding is responsible for each of the following except the force directly holding hydrocarbons together Correct.
_u810_BioChemistry,a2_HS-AWB-01_bonding-11,Covalent bonds can form between atoms of different elements Correct.
_u810_BioChemistry,a2_HS-AWB-01_bonding-10,"In biological molecules, oxygen forms how many covalent bonds? 2 Correct."
_u810_BioChemistry,a2_HS-AWB-01_bonding-09,"In biological molecules, uncharged nitrogen forms how many covalent bonds? 3 Correct."
_u810_BioChemistry,a2_HS-AWB-01_bonding-08,"In biological molecules, hydrogen always forms how many covalent bonds? 1 Correct."
_u810_BioChemistry,a2_HS-AWB-01_bonding-07,"In biological molecules, carbon always forms how many covalent bonds? 4 Correct."
_u810_BioChemistry,a2_HS-AWB-01_bonding-06,A negatively charged ion is called a(n) anion Correct.
_u810_BioChemistry,a2_HS-AWB-01_bonding-05,"An ion dissolved in water is surrounded by a shell of water in which all of the water molecules orient their hydrogen atoms toward the ion; therefore, the ion is an anion _ True Correct."
_u810_BioChemistry,a2_HS-AWB-01_bonding-04,"In the presence of water, ionic bonds are weaker than covalent bonds True Correct."
_u810_BioChemistry,a2_HS-AWB-01_bonding-03,"Covalent bonds involve the transfer of electrons between atoms, whereas ionic bonds result from a sharing of electrons _ False Correct."
_u810_BioChemistry,a2_HS-AWB-01_water-08,"Consider the following properties of water: high surface tension, high boiling point/temperature, high melting temperature _ What do they have in common? All are properties related to hydrogen bonding Correct."
_u810_BioChemistry,a2_HS-AWB-01_water-07,What is the maximum number of hydrogen bonds a water molecule can form with neighboring water molecules? four Correct.
_u810_BioChemistry,a2_HS-AWB-01_water-06,What type of bonds must be broken for water to vaporize? hydrogen bonds Correct.
_u810_BioChemistry,a2_HS-AWB-01_water-05,Which statement is true of the bonds in the water molecule? Shared electrons spend more time around the oxygen atom Correct.
_u810_BioChemistry,a2_HS-AWB-01_water-04,Newly formed ice does not sink to the bottom of a pond because water is less dense as solid ice than it is as a liquid Correct.
_u810_BioChemistry,a2_HS-AWB-01_water-03,Water on the surface of the skin helps cool the skin _ Which property of water is responsible for this effect? high heat of vaporization Correct.
_u810_BioChemistry,a2_HS-AWB-01_water-02,Water is a good solvent for some molecules because water forms spheres of hydration around ions and polar molecules _ True Correct.
_u810_BioChemistry,a2_HS-AWB-01_water-01,Water molecules are polar _ True Correct.
_u810_BioChemistry,inline_func_groups_q0," The structure of formamide is shown as a 2D drawing and in the 3D Jmol on the left _ This compound is an example of an functional group called an amide, containing the C=O and the -NH2 group, which is found in proteins _ This functional group is and the carbon attached to the oxygen has geometry polar tetrahydral Correct, both the oxygen and nitrogen are electronegative atoms _ In order to become charged, this functional group has to either accept protons (+ charge) or ionize, losing a proton (-charge) _ Can the individual O and N atoms do either of these? The nitrogen is not like an amino group in this case - it cannot be protonated _ The only way to assess the geometry is to rotate the 3D Jmol image."
_u810_BioChemistry,inline_func_groups_q1,Which of the following functional groups does NOT tend to make a molecule polar? phenyl group Correct _ Look through the content of the page again.
_u810_BioChemistry,inline_func_groups_q2,A molecule has hydroxyl groups as its predominant functional group _ Which of the following statements is true concerning this molecule? It should dissolve in water _ Correct _ Hydroxyl groups are polar goups that can participate in hydrogen bonding _ They dissolve in water _ Look through the content of the page again.
_u810_BioChemistry,inline_func_groups_q3,A polar solvent would easily dissolve the following: NaCl Correct _ NaCl is an ionic compoud and would dissolve in a polar solvent _ Look through the content of the page again.
redox,inline_digit-intrometabolism_intro_met_03,"Metabolic pathways are usually reversible Yes Correct, most degradative pathways can be reversed to become synthetic ones."
redox,inline_digit-intrometabolism_intro_met_02,"Metabolic pathways: all of these answers are correct _ Correct, all of these are properties of pathways."
redox,inline_digit-intrometabolism_intro_met_01,"An anabolic pathway consumes energy Correct, synthesis of complex materials consume energy."
redox,inline_l30_metreg_inhibitor_q3, How do product inhibitors actually inhibit the reactions of the substrate with it's enzyme? What is the most likely binding site on the enzyme for the product of the reaction? Compounds that are direct products of the reaction can bind to the active site with reasonable affinity _ Thus product inhibitors are inhibitors that compete with the substrate for the binding site; they are competitive inhibitors _ 
redox,regulation_response_regulation_response_q1," Would you expect the product of an enzyme catalyzed reaction function as a competitive or non-competitive inhibitor? Competitive inhibitor _ The product should fit into the active site – that’s where it is made to begin with _ Enzymes can even work in reverse: when too much product builds up – the enzyme can catalyze conversion of product back into reactants _ In some cases, the products can also function as non-competitive inhibitors, but the enzyme has to have a separate regulatory binding site (distinct from the active site) – see allosteric regulation below _ "
redox,inline_l30_metreg_regulation_mcq_30_q01," Which of the following is not a mechanism for altering the flux of metabolites through the rate-determining step of a pathway? Diffusional coupling between adjacent active sites _ Correct, This mechanism is not used for control, the other four that are listed are commonly used _ Look through all of the information on this page."
redox,inline_l30_metreg_regulation_mcq_30_q06," Phosphofructokinase, the major flux-controlling enzyme of glycolysis is allosterically inhibited by _ and activated by _ _ ATP, AMP Correct, Since glycolysis generates ATP, if [ATP] is high, less carbon is sent through the pathway by inhibiting PFK; the converse is true for high levels of AMP, which is produced by hydrolysis of ATP _ Look through all of the information on this page."
redox,inline_l30_metreg_regulation_mcq_30_q07," Which of the following step from glycolysis is performed by a different enzyme in gluconeogenesis? Phosphofructose kinase (PFK) Correct, Of the above list, only the PFK step is different, catalyzed by fructose-1.6-bis phosphatase."
redox,inline_digit-metabolism-regulation_metab-regul-02,Which of the following enzymes are most likely to be regulated in the following pathway (select all that apply): E4 E5 Correct.
redox,inline_digit-metabolism-regulation_metab-regul-01,"In the metabolic pathways shown below, which direction is anabolic, to the right or left? Left Correct, anabolic or synthetic pathways typically branch at the end of the pathway."
redox,inline_digit-metabolism-regulation_metab-regul-03,"In the pathway shown below, compound G would act as a product inhibitor for enzyme _ and a feedback inhibitor for enzyme _ _ E7, E4 Correct."
redox,inline_digit-metabolism-regulation_metab-regul-04,"If the substrate concentration for an enzyme is doubled, the rate of the reaction cannot be determined with this information _ Correct, since you don't know the initial substrate concentration you can't predict what will happen."
redox,inline_digit-metabolism-regulation_metab-regul-05,Phosphorylation of enzymes always results in inhibition of activity _ False Correct.
redox,a2_HS-pathway_regulation_pathways_q0," Many metabolic pathways involve multistep reactions _ Consider the following pathway: A --E1--> B --E2--> C --E3--> D where A, B, C, and D are substrates and/or products of the three enzymes, E1, E2, E3 _ Feedback inhibition of this pathway is usually associated with D interacting with an allosteric site on E1 Correct _ Biology is usually (but not always) efficient! In most metabolic pathways the final product (D in this case) is the useful product _ The other compounds (B,C) are probably not useful, except in the sense that they are necessary steps of the reaction _ Therefore, D will regulate E1 so that B and C are not made if there is sufficient D present _ "
redox,a2_HS-pathway_regulation_pathways_q1, The fundamental difference between competitive and uncompetitive inhibition is the manner of binding of the inhibitor to the enzyme Correct _ In competitive inhibition the inhibitor and substrate bind to the same site _ In uncompetitive inhibition they bind to physically different sites _ 
redox,a2_HS-pathway_regulation_pathways_q2," When substrate levels are very high (saturating) the presence of the following inhibitor type will not affect the maximal velocity (Vmax _ competitive inhibition Correct _ In competitive inhibition high levels of substrate can prevent binding of the inhibitor to the enzyme _ Therefore Vmax, the velocity at saturating substrate, is unchanged for competitive inhibition _ The binding of an uncompetitive inhibition is not affected by substrate binding and can therefore alter the kinetic efficiency of the enzyme, even in the presence of saturating substrate _ "
redox,a2_HS-pathway_regulation_pathways_q3, In allosteric interactions changes that take place in one site of a protein cause functionally important changes at a distant site Correct _ There are two key concepts: 1) Binding of a ligand at a site distant from the active site results in structural changes at the active site _ 2) These structural changes cause functional changes _ 
redox,a2_HS-pathway_regulation_pathways_q4," An allosteric activator is similar to an competitive inhibitor because it binds to the active site of an enzyme, increasing the catalytic rate _ False Correct _ An allosteric activator does not bind in the active site but elsewhere _ Its binding causes a change in the active site, increasing the activity of the enzyme."
redox,a2_HS-pathway_regulation_pathways_q5, Both allosteric activators and activation of enzymes by phosphorylation involve non-covalent binding of the activator to the enzyme _ False Correct _ An allosteric activator binds non-covalently while enzyme phosphorylation requires the formation of a chemical bond to between the enzyme and the phosphate.
redox,a2_HS-pathway_regulation_pathways_q6," Protein phosphorylation plays a role in the regulation of the activity of a number of enzymes _ Correct _ Protein phosphorylation, which occurs by the enzyme catalyzed addition of phosphate to Ser, Tyr, or Thr residues is commonly used to regulate many enzymes _ It is both rapid and reversible, making the process favorable for regulation _ This is discussed on pg 228 _ "
redox,inline_digit-metabolism_redox_metab_redox_01,"When a molecule participates in a redox reaction, which of the following properties of the molecule change? The number of electrons _ Correct."
redox,inline_digit-metabolism_redox_metab_redox_02,"Oxidation of a compound involves the _ and generally _ _ loss of electrons, releases energy _ Correct"
redox,inline_digit-metabolism_redox_metab_redox_03,"When a compound is oxidized, which of the following also occur _ another compound is reduced _ Correct."
redox,inline_digit-metabolism_redox_metab_redox_04,"Which of the following molecules is used by a cell to carry energy in the form of electrons from one pathway to another, NADH and FADH2 Correct _ Both of these molecules are used to carry energy in the form of electrons."
redox,inline_digit-metabolism_redox_metab_redox_05,"The compounds like the ones shown below occur in the TCA cycle and in fatty acid oxidation _ Given that these pathways are oxidative, what order do these compounds appear in the pathway? B, A, D, C Correct."
redox,inline_digit-metabolism_energy_metab-energy_01,"The products of ATP hydrolysis, ADP and inorganic phosphate, are more stable because Electrostatic repulsion between the phosphates is relieved _ Correct."
redox,inline_digit-metabolism_energy_metab-energy_02,ATP is an important molecule in metabolism because: _ It can be used as an energy source in many reactions _ Correct.
redox,inline_digit-metabolism_energy_metab-energy_03,Which of the following molecules is used by a cell to carry energy in the form of electrons? NAD+ Correct.
redox,inline_digit-metabolism_energy_metab-energy_04,The energy from electrons on electron carriers is used to directly form: _ A proton gradient Correct.
redox,inline_digit-metabolism_thermo_metab-thermo_01,A reaction will be spontaneous in the reverse direction if the standard energy change is positive _ false Correct.
redox,inline_digit-metabolism_thermo_metab-thermo_02,The direction in which a reaction is spontaneous is controlled by all of the following EXCEPT a catalyst Correct.
redox,inline_digit-metabolism_thermo_metab-thermo_03,"For the conversion of compound A to compound B to be spontaneous in the direction of A to B, the following will be true the Gibbs free energy change will be negative _ Correct."
redox,inline_digit-metabolism_thermo_metab-thermo_04,"If the standard energy change for converting [A] to [B] is zero, then the reaction will be spontaneous in the direction [A] to [B] under the following conditions? (Select all that apply) _ When the concentration of [A] is higher than its equilbrium value _ Correct."
redox,inline_digit-metabolism_coupling_meta_coupling_01,The reaction that converts A to B in a cell is nonspontaneous under standard conditions _ One means of overcoming this nonspontaneous reaction in the cell is to increase the amount of B and decrease the amount of A _ False Correct.
redox,inline_digit-metabolism_coupling_meta_coupling_02,The covalent bonding of a phosphate to molecule X to form X-P is a nonspontaneous process with a standard free energy (Go) change of +10 kJ/mole _ This reaction can be coupled to the hydrolysis of ATP with its free energy change of -30 kJ/mole _ The result is: the spontaneous phosphorylation of X with a standard free energy change of -20kJ/mole Correct.
redox,inline_digit-metabolism_coupling_meta_coupling_03,"The Gibbs free energy for a reaction can become negative by: _ all of these are correct _ Correct, both direct and indirect coupling can be used to make the Gibbs free energy less than zero."
redox,a2_HS-metab-energetics_energetics_q0,Which of the following is not a redox reaction? B Correct _ All of the reactions except B involve a two electron oxidation _ B is accomplished by the addtion of water to the double bond _ This reaction occurs in glycolysis as well as fatty acid oxidation _ 
redox,a2_HS-metab-energetics_energetics_q1,"The term ""high-energy bond"" refers to one for which hydrolysis releases a useful amount of energy _ Correct _ The incorrect answers are either overly specific or wrong altogether _ "
redox,a2_HS-metab-energetics_energetics_q2,"The hydrolysis of ATP can be used to drive reactions that have a DGo that is less than +30.5 kJ/mol _ Correct _ Because the DGo for ATP hydrolysis is -30.5 kJ/mol, it can drive any reaction with a energy change of less than 30.5 kJ/mol _ "
redox,a2_HS-metab-energetics_energetics_q3,The hydrolysis of a thioester releases as much energy as the hydrolysis of (pick the closest answer): ATP Correct _ 
redox,a2_HS-metab-energetics_energetics_q5,Which of the following are electron carriers? FADH2 Incorrect _ NADH and FADH2 are the only electron carriers _ 
redox,a2_HS-metab-energetics_energetics_q6,"If the standard energy difference between A and B is +10 kJ/mole then At equilbrium [A] is greater than [B] _ Correct _ Since B is higher in energy than A, it is more favorable for the system to prefer form A. _ "
redox,a2_HS-metab-energetics_energetics_q7,"If the Gibbs energy difference between A and B is -10 kJ/mole then The reaction will spontaneously go from A to B _ Correct, a negative Gibbs energy indicates that the concentration of A is larger than its equilibrium concentration _ "
redox,a2_HS-metab-energetics_energetics_q8,The phenomenon of coupling always involves reactions that produce energy and reactions that consume energy _ Correct _ The incorrect answers are all (only) partially correct _ 
redox,a2_HS-metab-energetics_energetics_q4," Order the following chemicals from lowest oxidation level to highest oxidation level _ Ethane, CH3-CH3 _ Formic Acid, O=CH-OH _ Acetaldehyde, CH3-CH=O _ Ethanol,CH3-CH2-OH _ Fully saturated hydrocarbons are the lowest oxidation level, carboxylic acids at the highest _ "
transformations_energy_matter,biochem_carbs_characteristic_DIGT_q1,"Which of the following statements about carbohydrates are true? Explore all of the options _ There is more than one correct answer _ Polysaccharides are carbohydrates _ Correct _ Polysaccharides are carbohydrate polymers _ If you have ever examined a nutrition label on a packaged food product, what is specifically listed as a subcategory under carbohydrates? "
transformations_energy_matter,biochem_carbs_characteristic_DIGT_q2,"Which could be a chemical formula for a carbohydrate? C6H12O6 Correct _ This molecule contains carbon, hydrogen, and oxygen in the proper ratio: the same number of carbon and oxygen atoms, and twice as many hydrogens _ Consider the word carbohydrate; if you break it down into parts (""carbo"" and ""hydrate""), which atoms/elements do you think are common to all carbohydrates? For each carbon atom, how many oxygen atoms should there be? For each oxygen, how many hydrogen atoms should there be? (The ratio is the same as that of water.) The ratios of elements are 1 C : 2 H : 1 O _ The only formula that fits this is glucose: 6 C : 12 H : 6 O."
transformations_energy_matter,biochem_carbs_assemble_DIGT_q1,"Which of the following carbohydrates contains a monosaccharide different from the others? lactose Correct _ Lactose is a disaccharide composed of one galactose monosaccharide and one glucose monosaccharide linked together _ Are the answer options disaccharides or polysaccharides? Identify the monosaccharides that make up each of your answer options _ All three polysaccharides are built from linking glucose monomers together _ However, don’t forget that the organization of these monomers differs between the three polysaccharides, imparting different functions."
transformations_energy_matter,biochem_carbs_dietary_DIGT_q1,"Humans obtain energy from each of the following carbohydrates EXCEPT which of the following? Explore all of the options; there is more than one correct answer _ cellulose Correct _ Humans and most animals lack the enzymes necessary to digest cellulose and extract energy _ We can only obtain energy from digestible carbohydrates _ In order for a carbohydrate to be digestible, an organism must have enzymes that can break it apart _ Cellulose makes up much of the dietary fiber in our food, and chitin is found in crab shells _ We cannot get energy from these carbohydrates _ "
transformations_energy_matter,biochem_carbs_fiber_DIGT_q1,"A friend of yours has mentioned that her child is suffering from chronic constipation _ All of the following foods would be good suggestions to help correct the child's digestive issues, EXCEPT: cheddar cheese Correct _ Foods high in fats, such as cheeses, can cause constipation _ A diet high in fiber can help alleviate the effects of constipation _ Plant products often contain fiber _ Cheddar cheese is a dairy product (produced from cow’s milk) and is high in fat, not fiber."
transformations_energy_matter,biochem_carbs_quiz_biochem_carbs_pool_q1,Which polysaccharide is most similar to chitin? Cellulose Correct _ Both cellulose and chitin are linear molecules used for structure _ 
transformations_energy_matter,biochem_carbs_quiz_biochem_carbs_pool_q2," Which of the following are functions of carbohydrates? Select all that apply _ Energy storage Structure Cell recognition Cell signaling Correct! There are four functions of carbohydrates: energy storage, structure, cell recognition and cell signaling."
transformations_energy_matter,biochem_carbs_quiz_biochem_carbs_pool_q3,What do starch and cellulose have in common? Select all that apply _ They are both made of glucose subunits _ They are both made by plants _ Correct!
transformations_energy_matter,biochem_carbs_quiz_biochem_carbs_pool_q4,Which of the following is characterized as dietary fiber? Cellulose Correct _ Cellulose is not digestible by humans.
transformations_energy_matter,biochem_carbs_quiz_biochem_carbs_pool_q5,"What type of molecule is shown here? Carbohydrate Correct! This molecule is C6H12O6, which the the formula for a carbohydrate."
transformations_energy_matter,biochem_carbs_quiz_biochem_carbs_pool_q6,What characteristic of carbon makes it a good backbone for creating diverse and durable molecules? Carbon forms four covalent bonds _ Correct _ Carbon’s ability to form four (4) covalent bonds makes it an excellent atom to build backbones.
transformations_energy_matter,biochem_carbs_quiz_biochem_carbs_pool_q7,Which of the following is characteristic of carbohydrates? Carbohydrates are hydrophilic and have the general formula CH2O _ Correct _ Carbohydrates are made polar and therefore hydrophilic _ They are hydrates of carbon which means they have the general formula CH2O.
transformations_energy_matter,biochem_carbs_quiz_biochem_carbs_pool_q8,This carbohydrate is produced by animals for energy storage Glycogen Correct _ Animals produce glycogen to store energy.
transformations_energy_matter,biochem_carbs_quiz_biochem_carbs_pool_q9,Which of the following is the smallest? Ribose Correct _ Ribose is a monosaccharide.
