transformations_energy_matter,inline_digit-metabolism_glycolysis_metab-glyco_04,"Direct coupling is used to make which steps in glycolysis spontaneous _ The conversion of: _ Glucose to Glucose-6-P; and, Fructose-6-P to Fructose-1,6-P Correct _ "
transformations_energy_matter,inline_digit-metabolism_glycolysis_metab-glyco_05,Indirect coupling is used to make which step in glycolysis spontaneous _ Correct.
transformations_energy_matter,inline_digit-metabolism_glycolysis_metab-glyco_06,Cells switch from cellular respiration (aerobic glycolysis) to fermentation: _ when a source of the terminal electron acceptors is not available _ Correct.
transformations_energy_matter,a2_HS-metab-glycolysis_glycolysis_q0, Which statement best characterizes the role of enzymes in glycolysis? Each step is catalyzed by a separate enzyme Correct _ Glycolysis can be considered a 'simple' metabolic pathway _ Each step is catalysed by an independent enzyme.
transformations_energy_matter,a2_HS-metab-glycolysis_glycolysis_q1," The flow of carbon through glycolysis can be described as: Cleavage of a six carbon sugar into two three carbon molecules, followed by their oxidation _ correct."
transformations_energy_matter,a2_HS-metab-glycolysis_glycolysis_q2," A cofactor that is involved in the oxidation of glyceraldehyde-3-phosphate to 1,3-bisphosphoglycerate in glycolysis is NAD+ Correct _ ."
transformations_energy_matter,a2_HS-metab-glycolysis_glycolysis_q3, Glycolysis does not require O2 to generate energy Correct _ Glycolysis can (and often does) occur in the absence of oxygen.
transformations_energy_matter,a2_HS-metab-glycolysis_glycolysis_q4, The phosphorylation of glucose to glucose 6-phosphate (G-6-P) Requires energy from ATP to occur _ Correct _ The formation of all phosphorylated compounds requires some energy _ Therefore formation of G-6-P is not exergonic _ The energy produced by hydrolysis of ATP drives the reaction.
transformations_energy_matter,a2_HS-metab-glycolysis_glycolysis_q5," Glucose is prevented from leaving the cell once it enters because: It is converted to glucose-6-P, which cannot exit through the glucose transporter _ Correct _ Revisit the animation."
transformations_energy_matter,a2_HS-metab-glycolysis_glycolysis_q6," The conversion of F-1,6-P to two three carbon sugars by the enzyme aldolase has a standard energy change of +25 kJ/mol _ This reaction is sponaneous in glycolysis with a Gibbs energy of ~0 because: A subsequent reaction in glycolysis is highly favorable _ Correct _ This keeps the concentration of the products below their equilibrium levels - an example of indirect coupling."
transformations_energy_matter,a2_HS-metab-glycolysis_glycolysis_q7," The energy released by glucose oxidation is captured on _ and _ _ ATP, NADH Correct _ Two ATPs and two NADH are produced."
transformations_energy_matter,a2_HS-metab-glycolysis_glycolysis_q8," Alcohol dehydrogenase in yeast serves the same role as lactate dehydrogenase in mammals _ This role is? To regenerate NAD+for glycolysis _ Correct, in the absence of oxygen NAD+ is not regenerated, stalling glycolysis which requires NAD+ _ "
transformations_energy_matter,inline_digit-metabolism_tca_metab_tca_01,"In cellular respiration, the majority of the carbon dioxide production takes place in: the citric acid cycle Correct _ Four of the six carbons from glucose are released here."
transformations_energy_matter,inline_digit-metabolism_tca_metab_tca_02,The citric acid cycle takes place in _ and functions to _ _ the mitochondrial matrix; oxidize acetylCoA to carbon dioxide Correct.
transformations_energy_matter,inline_digit-metabolism_tca_metab_tca_03,Which of the following products of the Citric Acid Cycle carries electrons and protons to the electron transport chain? NADH Correct.
transformations_energy_matter,inline_digit-metabolism_tca_metab_tca_04,"In the TCA cycle the oxidation of _ produces _ and in some reactions also produces _ _ a alcohol, NADH, CO2 Correct _ Three oxidations steps produce NADH, two of which result in the release of CO2."
transformations_energy_matter,inline_digit-metabolism_tca_metab_tca_05,"In mammals, all of the following can be produced from acetyl CoA or from compounds in the TCA cycle, with the exception of: _ glucose Correct, glucose can only be synthesized from pyruvate."
transformations_energy_matter,inline_digit-metabolism_etrans_atp_meta_etrans_atp_01,The movement of electrons down the electron transport chain performs work _ The work is used to: _ pump protons Correct.
transformations_energy_matter,inline_digit-metabolism_etrans_atp_meta_etrans_atp_02,Which of the following only carries electrons from NADH? Complex I Correct.
transformations_energy_matter,inline_digit-metabolism_etrans_atp_meta_etrans_atp_03,"The terminal electron acceptor in anaerobic respiration is: _ pyruvate Correct _ Pyruvate is converted to lactate in anaerobic metabolism, to regenerate NAD+ for glycolysis."
transformations_energy_matter,inline_digit-metabolism_etrans_atp_meta_etrans_atp_04,The direct energy source that drives ATP synthesis during respiratory oxidative phosphorylation is the electrochemical gradient of protons on opposite sides of the inner membrane of the mitochondrion Correct.
transformations_energy_matter,inline_digit-metabolism_etrans_atp_meta_etrans_atp_05,"During ATP synthesis, proton translocation through ATP synthase produces _ converting _ to _ _ a conformational change, ADP, ATP _ Correct."
transformations_energy_matter,a2_HS-metab_tca_etran_tca_etrans_q0, The key two-carbon intermediate from glucose as well as fatty-acid oxidation is: acetyl-Coa Correct _ 
transformations_energy_matter,a2_HS-metab_tca_etran_tca_etrans_q1, The oxidation of pyruvate and a-ketoglutarate produce _ and _ _ a thioester and NADH Correct _ 
transformations_energy_matter,a2_HS-metab_tca_etran_tca_etrans_q3, Which of the following metabolite cannot be obtained by utilization of compounds in the TCA cycle? carbohydrates Correct _ 
transformations_energy_matter,a2_HS-metab_tca_etran_tca_etrans_q4, The final reduced species in the electron transport chain is H2O Correct _ Oxygen is reduced to water at the last step _ 
transformations_energy_matter,a2_HS-metab_tca_etran_tca_etrans_q5, The oxidation of NADH uses all but which electron transport complex? II Correct _ This complex is responsible for oxidation of FADH2 
transformations_energy_matter,a2_HS-metab_tca_etran_tca_etrans_q6, The synthesis of ATP in the mitochondria occurs by: Proton driven conformational change _ Correct _ This is the best answer.
transformations_energy_matter,a2_HS-metab_tca_etran_tca_etrans_q2," The oxidation of succinate to oxaloacetate in a number of steps _ Beginning with the reactant and ending with the final product, place the following compounds in the correct order _ Alcohol _ Ketone _ Alkane Alkene The correct order is alkane (succinate) -> alkene (fumarate) -> alcohol (malate) -> ketone (oxaloacetate) _ "
struc_fun,proteins_oxygen_q1,"Oxygen is transported from the lungs to the tissues by dissolving directly in blood _ false Correct _ Oxygen binds to the protein hemoglobin, which is found in red blood cells _ Proteins perform most of the biological functions in organisms _ Proteins are involved in oxygen transport."
struc_fun,proteins_oxygen_q2,"Which of the following proteins is involved in protecting your body from harmful bacteria? antibodies Correct _ Antibodies are proteins that help protect your body from harmful invaders, like bacteria _ One of the incorrect answers is used to carry oxygen in your blood _ One of the incorrect answers is involved in nerve conduction _ One of the incorrect answers is responsible for cellular signaling."
struc_fun,proteins_oxygen_q3,Proteins that catalyze chemical reactions are called: enzymes Correct _ Enzymes are proteins that catalyze chemical reactions _ One of the roles of the chemical reactions that are catalyzed by these proteins is the breakdown of food during digestion.
struc_fun,proteins_oxygen_q4_biomacro_function,"Which of the following is a function common to the macromolecules: carbohydrates, lipids and proteins? Energy storage Correct _ All three macromolecules can be used to store nutrients, and later, can be broken down to release energy _ All three macromolecules also possess a structural role _ Recall that lipid functions include energy storage, membrane structures, and hormones _ Recall that carbohydrate functions include cell structure, cell identity, and energy storage _ Recall that proteins have a larger variety of functions including structural, energy storage, and hormones."
struc_fun,_m4_amino_acid_parts_DIGT_q1,"In the above diagram of an amino acid, which color represents the amino group? blue Correct."
struc_fun,_m4_amino_acid_parts_DIGT_q2,"In the above diagram of an amino acid, which color represents the carboxyl group? red Correct."
struc_fun,_m4_amino_acid_parts_DIGT_q3,"In the above diagram of an amino acid, which color represents the alpha carbon? green Correct."
struc_fun,_m4_amino_acid_parts_DIGT_q4,"In the above diagram of an amino acid, which color represents the variable group? gray Correct."
struc_fun,_m4_amino_acids_LBD_q1,"The amino acid asparagine is shown as a chemical drawing _ (Note that there are NO carbon atoms represented by a “C” drawn in this figure _ However, you know that there is a carbon atom at every intersection that does not have a letter.) One group of atoms is highlighted in yellow; the second group of atoms is highlighted in pink _ Which group of highlighted atoms represents the atoms that are found in all amino acids? pink Correct _ All amino acids have the following series of bonded atoms: Nitrogen - alpha carbon - carboxylic acid carbon."
struc_fun,_m4_amino_acids_LBD_q2,"The structure of two amino acids is shown, with the side-chain atoms (R group) highlighted in yellow _ Which of these amino acids has a polar (hydrophilic) side chain, such that it would like to interact with water? serine Correct _ Its side chain OH group can interact with water, via hydrogen bonding _ Side-chain atoms that are more similar to water (H2O) are more likely to interact with water."
struc_fun,_m4_amino_acids_LBD_q3_serine," Which of the following sructures is an amino acid? B _ Correct: This is the amino acid serine containing an amino group and a carboxyl group linked by a single, alpha, carbon as shown in this labeled image _ Recall that an amino acid contains both a amino group and a carboxylic group _ An amino group is NH2 and a carboxylic group is COOH _ An amino acid contains an amino group and a carboxylic group and both must be attached to the alpha carbon _ "
struc_fun,_m4_tripeptide_LBD_q1,"The following shows the dipeptide alanine-serine _ Four bonds are labeled (a, b, c, d) _ Which one is the peptide bond? c Correct _ This bond is connecting the carboxyl group on the first amino acid to the nitrogen group on the second amino acid _ The peptide bond is a new bond formed when two amino acids are joined _ A peptide bond involves main-chain atoms, not side-chain atoms."
struc_fun,_m4_tripeptide_LBD_q2,"The following shows the dipeptide alanine-serine _ Four atoms are labeled _ Which atom will be used to join to a third amino acid, making a tripeptide? c Correct _ This is the carboxylic acid group of the second atom _ It will form a peptide bond with the nitrogen group in the third amino acid _ The next amino acid is added to one end of the dipeptide _ The two ends of a peptide are the amino (NH3+) and carboxylic acid (COO-) New amino acids are added to the carboxylic acid."
struc_fun,_m4_peptide_denature_LBD_q1,"Do you think peptide bonds are broken when proteins unfold and become denatured? no Correct _ The length of the polypeptide chain is the same in all three forms _ Compare the lengths of the polypeptide chains in all three forms in the above diagram _ What would happen to the length of the chain if peptide bonds were broken? Notice that all the polypeptide chains in the diagram are the same length _ If peptide bonds were broken during unfolding, you would see many short pieces of the protein."
struc_fun,_m4_peptide_denature_LBD_q2,"Can you think of an example of protein denaturation that often occurs when making breakfast? When you cook an egg, the proteins in the egg white denature and aggregate _ This transforms the transparent egg fluid into a white solid."
struc_fun,_m4_aa_folding_DIGT_q1,"In the above diagram showing the more stable folded structure, which type of amino acid is more likely to be found on the interior of the protein? nonpolar (hydrophobic) Correct _ Hydrophobic substances would try to get away from the water by burying themselves deep in the protein."
struc_fun,_m4_aa_folding_DIGT_q2,"A folded protein is shown on the right side of this image _ The main-chain connections are not drawn between the atoms _ Which of the two sequences on the left, A or B, can possibly fold into the shape on the right? A Correct _ The four hydrophobic amino acids are nicely buried in the structure shown here _ "
struc_fun,_m4_proteins_antibody_binding_LBD_q1," The complete structure of an antibody is shown on the left _ The part of the antibody that is circled is the antigen binding site of the antibody _ Protein (antigens) from the cell surface of four harmful bacteria (A, B, C, D) are shown on the right _ Which of the four will bind more effectively to the antibody? C Correct _ Both the size and charge complementarity are correct (opposite charges attract) _ The antigen that is most complementary to the antigen binding site will bind most effectively _ Which of the options has the right shape to fit the binding site? Which of the options also has the proper charge to be attracted to the binding site?"
struc_fun,_m4_proteins_antibody_binding_LBD_q2,"What surface antigen would you expect to see on a bacteria that was effectively destroyed by the antibody? C Correct _ The antibody will bind to this antigen _ In order for your immune system to eliminate the bacteria, the antibody must bind to it first."
struc_fun,_m4_enzyme_catalysis_DIGT_q1,"When an enzyme catalyzes a reaction: it lowers the activation energy of the reaction _ Correct _ Lowering the activation energy of a reaction makes it more likely to occur _ Enzymes make reactions happen faster _ Enzymes help the chemical reaction take place, but they do not participate in it."
struc_fun,_m4_enzyme_catalysis_DIGT_q2,"What will happen to the rate at which a chemical reaction proceeds if the activation energy is increased? The reaction will happen slower (at a lower rate) _ Correct _ If the activation energy goes up, then more energy is required for the reaction to occur, so it will happen less often."
struc_fun,_m4_antacid_DIGT_q1,"In the human stomach, proteins are digested by pepsin, an enzyme that requires an acidic pH for its optimal function _ Antacids are medications that increase stomach pH _ Examples include Alka-Seltzer, Tums, and Rolaids _ If a person overuses antacids, how do you think this might affect that person's digestive process? Think about what happens to acidic pH if an antacid is added _ Think about what happens to a protein’s function when the pH is not optimal _ When the pH is raised or increased, the activity of pepsin will decrease, which in turn decreases protein digestion."
struc_fun,_m4_enzyme_curve_DIGT_q1,"Which of the following curves best represents the activity of a human enzyme as a function of temperature? (The temperature scale is in Fahrenheit; normal body temperature is 98.6 degrees F) _ C Correct _ At first, the rate increases due to the activation of more substrate molecules, but the activity drops to zero when the enzyme denatures at 100 degrees _ What happens to most proteins at high temperatures?"
struc_fun,aa_proteins_quiz__m4_amino_acids_pool_q1,"The following structure is the amino acid glutamic acid _ Four atoms (or groups of atoms) are labeled (a,b,c,d) _ Which one of these atoms will be found on all amino acids? Atom D Correct, this is the alpha carbon, found in all amino acids, joining the amino group to the carboxylic acid group."
struc_fun,aa_proteins_quiz__m4_amino_acids_pool_q2,"The amino acid valine is shown with its sidechain atoms highlighted in yellow _ Do you think this amino acid is hydrophilic or hydrophobic? hydrophobic (non-polar) Correct! There are no oxygen atoms here, so the side chain does NOT look like water _ Therefore, it probably does not interact well with water!"
struc_fun,aa_proteins_quiz__m4_amino_acids_pool_q3,This amino acid is _ _ hydrophilic Correct _ The oxygens on the side chain make this a hydrophilic amino acid.
struc_fun,aa_proteins_quiz__m4_amino_acids_pool_q4,Where do peptide bonds form? Between the carboxyl group of one amino acid and the amino group of another amino acid _ Correct _ Peptide bonds form between the amino group of one amino acid and the carboxyl group of the next amino acid in a protein chain.
struc_fun,aa_proteins_quiz__m4_amino_acids_pool_q5,Amino acids in a protein chain are attached by bonds called _ _ peptide bonds Correct _ These bonds are called peptide bonds.
struc_fun,aa_proteins_quiz__m4_proteins_pool_q1,"The following shows the dipeptide alanine-serine _ Four atoms are labeled _ Which atom is part of the peptide bond that joins the two amino acids? Atom B Correct, this atom was used to form the first peptide bond, joining serine to alanine."
struc_fun,aa_proteins_quiz__m4_proteins_pool_q2,Which of the following diagrams represents the correct structure of a protein? Each blue-gray-red box represents an amino acid _ Correct _ The amino group of each amino acid is joined to the carboxylate group of the preceding amino acid.
struc_fun,aa_proteins_quiz__m4_proteins_pool_q3,"The peptide bond that forms between two amino acids is an example of a(n): covalent bond Correct, because there is sharing of electron between the carboxylic carbon on one amino acid and the amino nitrogen on the next amino acid."
struc_fun,aa_proteins_quiz__m4_proteins_pool_q4,"Which of the following is the correct result after adding the amino acid serine to a dipeptide made of two alanine residues? Correct, the amino group of the new amino acid is added to the carboxylic acid group of the preceding amino acid."
struc_fun,aa_proteins_quiz__m4_proteins_pool_q5,Which of the following changes when a protein denatures? Three dimensional structure Correct _ A denatured protein unfolds and changes is shape.
struc_fun,aa_proteins_quiz__m4_proteins_pool_q6,"The sequence and folded form of three different proteins are shown below _ Although the sequences are different, the folded structures are the same (S shaped) _ Which of the following three structures will be the least stable (white=polar sidechains, black=non-polar sidechains) _ protein C Correct _ 'C' is the least stable because two non-polar residues are exposed and one polar residue is buried."
struc_fun,aa_proteins_quiz__m4_enzymes_pool_q1,"A ligand cannot bind to the active site of an enzyme _ False Correct - Competitive inhibitors can bind to the active site _ Since it is not converted to product by the enzyme it would be considered to be a ligand _ The substrate also binds to the active site, but it is converted to product _ "
struc_fun,aa_proteins_quiz__m4_enzymes_pool_q2,"Which of the following four proteins would bind best to the antibody? The portion of the antibody the binds the protein is shown on the left, the proteins (A, B, C, D) on the right _ Protein C Correct, the shape matches, and if you flip C both of the charges are opposite to those on the antibody."
struc_fun,aa_proteins_quiz__m4_enzymes_pool_q3,"Two enzymes catalyze the same reaction _ Enzyme A converts substrate to product twice as fast as enzyme B _ Which enzyme has the lower activation energy or energy barrier: A or B? Enzyme A Correct, a lower activation energy means that more substrate will be in the activated state and proceed to product."
struc_fun,aa_proteins_quiz__m4_enzymes_pool_q4,"Which of the following curves best represents the activity of an enzyme isolated from a bacteria that lives in the hot springs in Yellowstone (water temperature 120 degrees C)? curve B Correct The rate increases until 120C because the enzyme is thermostable, i.e _ resistant to denaturation, allowing the organism to live at high temperatures _ Note that at higher temperatures it denatures."
struc_fun,aa_proteins_quiz__m4_enzymes_pool_q5,"Which of the following plots more correctly shows the activity of pepsin as a function of pH? plot A Correct, pepsin is a digestive enzyme in the stomach, so it will be most active at the pH of the stomach _ The activity will drop at very low or very high pH because the enzyme will denature."
struc_fun,aa_proteins_quiz__m4_enzymes_pool_q6," An enzyme binds the indicated substrate and converts it to product by removing two hydrogen atoms and forming a double bond between the two middle carbons _ Compounds A and B are inhibitors of this enzyme _ Which of the two inhibitors is a non-competitive inhibitor? Compound B Correct, this compound does not look like the substrate, so it will probably not bind to the active site, but bind elsewhere - this is a non-competitive inhibitor."
struc_fun,aa_proteins_quiz__m4_enzymes_pool_q7,Where do competitive inhibitors bind on an enzyme? active site Correct _ Competitive inhibitors bind to the active site.
phys_prop_cell,inline_lipids_key_characteristic_q1_lipid_key_characteristic,"A friend brings you an unknown jar of organic molecules he found in his garage _ You’ve been studying lipids _ What test could you do to determine, FOR SURE, if the substance was a lipid? Put it in water _ If it is a lipid, it won’t dissolve easily _ Correct _ This is the defining characteristic of lipids _ They are hydrophobic, so they do not dissolve easily in water _ Only hydrophilic substances dissolve easily in water _ What is the defining characteristic of lipids? Remember, lipids are nonpolar _ Remember, lipids are hydrophobic."
phys_prop_cell,inline_lipids_characteristic_lipid-MB-08,"Which of the following statements applies to all lipids? All lipids are more soluble in nonpolar solvents than in water _ Correct _ Lipids are a diverse group of molecules defined primarily based on solubility _ Which of these is a characteristic of lipids? One of these is an example of a lipid, it is not a characteristic of all lipids _ Do lipids dissolve in water? Think about waxes and oils, which are examples of lipids."
phys_prop_cell,inline_lipids_id_examples_q1_steroid," Identify this lipid: Steroid Correct _ This is a molecule of cholesterol _ Like all steroids, this molecules has four carbon rings _ This molecule has four carbon rings."
phys_prop_cell,inline_lipids_id_examples_q2_fats_oils, What type of lipid is shown in the chemical structure below? Fat/oil Correct _ Fats and oils have three long carbon chains attached to glycerol (a short carbon chain) _ This molecule has three long carbon chains attached to a shorter carbon chain.
phys_prop_cell,inline_lipids_id_examples_q3_phospholipid, Identify this lipid: Phospholipid Correct _ Phospholipids have two long carbon chains and a phosphate group attached to glycerol (a short carbon chain) _ This molecule has two long carbon chains and a phosphate group (drawn in the circle) attached to a shorter carbon chain.
phys_prop_cell,inline_lipids_wax_structure_q1, Look carefully at the chemical structure above _ How do you know this is a wax? This is a wax because it has two long hydrocarbon chains linked to an ester group in the middle _ Correct _ See the carbon that has formed a double bond with one oxygen and a single bond with another oxygen? That indicates this is an ester _ Waxes have two long hydrocarbon chains linked by an ester group _ Ester groups have a carbon that forms a double bond with one oxygen and a single bond with another oxygen.
phys_prop_cell,inline_lipids_wax_structure_q2," Which of the following is NOT a function of waxes? They are used as an energy source for bees _ Correct _ Bees make wax to store their honey, but they do not eat the wax _ They eat the honey, which is a carbohydrate _ Look for the thing that waxes do NOT do."
phys_prop_cell,inline_lipids_cholesterol_q1_lipids_cholesterol,"Which of the following statements is true about cholesterol? Cholesterol does not dissolve easily in water _ Correct _ Because cholesterol is a lipid, you know that it will not dissolve well in water _ Think about the characteristics of ALL lipids _ Remember, lipids are hydrophobic."
phys_prop_cell,inline_lipids_cholesterol_q2_lipids_steriods,Which of the following are functions of steroids? (More than one answer is correct.) Steroids can be hormones _ Correct _ Steroids such as testosterone are hormones.
phys_prop_cell,inline_lipids_fatty_acids_characteristics_q1_cc_double_bond,Carbon-carbon double bonds Unsaturated fats Correct _ Unsaturated fatty acids have at least one double bond between two carbons _ Double bonds are present if the carbons are not saturated with hydrogens.
phys_prop_cell,inline_lipids_fatty_acids_characteristics_q2_glycerol,Four fatty acids attached to a glycerol Neither Correct _ Both saturated and unsaturated fats have three (not four) fatty acids attached to a glycerol _ These are called triglycerides.
phys_prop_cell,inline_lipids_fatty_acids_characteristics_q3_energy_sotrage,Used for energy storage Both Correct _ Triglycerides (both saturated and unsaturated) are excellent energy storage molecules _ What is the main function of triglycerides as a group?
phys_prop_cell,inline_lipids_fatty_acids_characteristics_q4_bent_carbon_chains,Bent carbon chains Unsaturated fats Correct _ The double bonds of unsaturated fats result in bent carbon chains _ Double bonds cause the carbon chain to bend _ Which of these has double bonds?
