cell_repro_and_genetics,inline_cell_structures_and_function_q3," At the end of the S stage, how many chromosomes will exist in the cell? double the number Correct _ During the synthesis (S) stage, the DNA is replicated so that the nucleus can be divided during mitosis and result in two genetically identical cells _ Chromosomes contain DNA and protein _ During the synthesis (S) stage of the cell cycle, DNA is duplicated _ Double the amount of DNA results in a duplicate number of chromosomes."
cell_repro_and_genetics,inline_m1_prophase_function_DIGT_q1,Nucleoli: _ Dismantled Correct _ The nucleoli are not needed for cell division and are dismantled.
cell_repro_and_genetics,inline_m1_prophase_function_DIGT_q2,Nuclear envelope: Dismantled Correct _ Dismantling the nuclear envelope allows components of the mitotic spindle to attach to the DNA inside the nucleus.
cell_repro_and_genetics,inline_m1_prophase_function_DIGT_q3,Mitotic spindle: _ Built Correct _ The mitotic spindle is made of microtubules that attach to the chromosomes and move them to opposite poles of the cell.
cell_repro_and_genetics,inline_m1_prophase_LBD_q1,Explain what happens to the cell during the prophase of cell division _ The DNA condenses and the nuclear membrane begins to breakdown _ 
cell_repro_and_genetics,inline_m1_prophase_LBD_q2," What structure moves the chromosomes to the correct location for cell division? Microtubule Correct _ The microtubules attach the chromosomes to the centrioles _ As the microtubules extend, they form spindle-like structures that push the centrosomes to opposite poles of the cell _ This structure is attached to the chromosomes at one end and the poles of the cell at the other end _ "
cell_repro_and_genetics,inline_m2_metaphase_LBD_q1," In order to move and line up the chromosomes during metaphase, the microtubules attach to which of the following chromosomal structures? centromeres Correct _ During metaphase, microtubules attached to the centromeres line up the chromosomes down the middle of the cell _ Remember that the centromere connects two sister chromatids each with the same genetic information _ Microtubules attach to the point where sister chromatids are held together _ Centromese connect sister chromatids."
cell_repro_and_genetics,inline_m3_anaphase_function_DIGT_q1,How are kinetochore and nonkinetochore microtubules defined? Kinetochore microtubules are attached to chromosomes; nonkinetochore microtubules are not _ Correct _ Kinetochore microtubules are attached to the kinetochore proteins on the centromere of the chromosome _ Kinetochore proteins are located on the centromeres _ Microtubules that attach to the kinetochore proteins are called kinetochore microtubules.
cell_repro_and_genetics,inline_m3_anaphase_function_DIGT_q2,"What are the functions of kinetochore and nonkinetochore microtubules? Kinetochore microtubules help chromosomes move; nonkinetochore microtubules change the shape of the cell _ Correct _ Kinetochore microtubules are broken down to move chromosomes to the opposite poles; nonkinetochore microtubules are elongated, which elongates the cell _ Kinetochore microtubules are connected to the centromeres on the chromosomes _ Nonkinetochore microtubules from one pole of the cell push against the nonkinetochore microtubules from the other pole."
cell_repro_and_genetics,inline_m4_telophase_DIGT_q1,"How many cells are there at the end of telophase? One Correct _ The cell now has two nuclei, but they have not been split into separate cells yet."
cell_repro_and_genetics,inline_mitosis_phases_DIGT_q1,"Image C illustrates a cell in what stage of mitosis? Metaphase Correct _ The cell shown in image C is in the metaphase stage of mitosis _ The chromosomes are all aligned along the center of the cell _ This stage precedes anaphase, where the chromosomes are moved to opposite sides of the cell _ This stage occurs in the middle of mitosis."
cell_repro_and_genetics,inline_mitosis_phases_DIGT_q2," What happens in the mitosis stage shown in image A? The nucleus disintegrates, allowing the chromosomes to sort and organize _ Correct _ During prometaphase, the nucleus dismantles so that chromosomes can split into identical pairs of double-stranded chromatids _ Image A shows the cell just before microtubules completely attach the chromosomes to the centriole _ Image A depicts the cell before metaphase, but after prophase."
cell_repro_and_genetics,inline_mitosis_phases_DIGT_q3," Which choice represents the correct sequence of mitotic phases in the images above? D | B | A | C Correct _ Mitosis starts by replicating DNA in the interphase _ The nucleus disappears during the prophase and prometaphase, and then chromosomes line up in the middle of the cell during metaphase _ Prophase, where the chromosomes are visible but not organized into pairs, comes first _ As the cell proceeded through mitosis, the chromosomes are organized, and microtubules attach to the chromosomes _ Microtubules organize the chromosomes such that they are all lined up at the center of the cell"
cell_repro_and_genetics,inline_mitosis_phases_DIGT_q4,"The image above represents what stage of mitosis? Anaphase Correct _ In anaphase, paired chromosomes, pulled by microtubules, separate and move to opposite poles of the cell _ This the stage before two new nuclei form _ During this phase, sister chromatids joined at the centromere are pulled to opposite poles of the cell."
cell_repro_and_genetics,inline_cell_repl_predict_genes_DIGT_q1," Given that dogs have 39 pairs of chromosomes, how many total chromosomes can be found in a skin cell of a dog? 78 Correct _ The total number of chromosomes is two times the number of pairs (2 x 39) because there are two copies of each chromosome."
cell_repro_and_genetics,inline_cell_repl_predict_genes_DIGT_q2," How many pairs of chromosomes will be found in each daughter canine skin cell after mitosis occurs? 39 Correct _ Each daughter cell will have 39 pairs of chromosomes, just like the parental cell."
cell_repro_and_genetics,inline_cell_repl_predict_genes_DIGT_q3," You are studying mitosis in dog skin cells _ You observe a cell under a microscope that contains two sets of 39 chromosome pairs located on opposite sides of the cell _ You also note that it looks like nuclear envelopes are beginning to form around the chromosomes at each side of the cell _ The cell you observed is in which stage of mitosis? Telophase Correct _ In telophase, the daughter chromosomes have been pulled to opposite poles of the cell (which happened in anaphase), and a new nuclear envelope forms around each group of chromosomes."
cell_repro_and_genetics,inline_cell_repl_predict_genes_DIGT_q4, True or False? A dog skin cell containing 78 chromosomes is a diploid cell _ True Correct _ Dog skin cells are somatic cells and contain two copies of each of the 39 chromosomes _ This makes them diploid _ Dog gamete cells (eggs or sperm) are haploid and contain only one copy of each chromosome.
cell_repro_and_genetics,inline_cell_cycle_irregular_cancer_q1,What do tumor suppressor genes do? They prevent uncontrolled cell division _ Correct _ Tumor suppressor genes prevent uncontrolled cell division _ This is how they prevent (or suppress) tumors.
cell_repro_and_genetics,inline_cell_cycle_irregular_cancer_q2,What do proto-oncogenes do? They encourage the process of cell division _ Correct _ Proto-oncogenes encourage cell division.
cell_repro_and_genetics,inline_cell_cycle_irregular_cancer_q3,"Which function most closely describes how BOTH tumor suppressor genes and proto-oncogenes work? They regulate the cell cycle _ Correct _ While both genes have different functions, they both affect cell division by regulating the cell cycle."
cell_repro_and_genetics,cell_div_mitosis_quiz_cell_div_mitosis_quiz_pool_q1,Which of the following tasks is accomplished through the process of mitosis? Replacement of dysfunctional cells Yes _ Mitosis enables dysfunctional cells to be replaced.
cell_repro_and_genetics,cell_div_mitosis_quiz_cell_div_mitosis_quiz_pool_q2,An organism grows through what process? Mitosis Yes! Mitosis is cell division that results in growth.
cell_repro_and_genetics,cell_div_mitosis_quiz_cell_div_mitosis_quiz_pool_q3, What stage of cell division is illustrated below? Metaphase Yes! The chromosomes are lined up on the middle of the cell.
cell_repro_and_genetics,cell_div_mitosis_quiz_cell_div_mitosis_quiz_pool_q4, What stage of division is this cell in? Metaphase Yes! The chromosomes are lined up on the middle of the cell.
cell_repro_and_genetics,cell_div_mitosis_quiz_cell_div_mitosis_quiz_pool_q5," Cancer can be the result of all of the following EXCEPT? A functional tumor suppressor gene and a functional proto-oncogene _ Correct _ Proto-oncogenes give the cell a signal to undergo cell division but only when the cell should be dividing _ Tumor suppressor genes, inhibit cell division so that a cell cannot divide uncontrollably _ It is when only these genes are both non-functional, that they can result in cancer development."
cell_repro_and_genetics,cell_div_mitosis_quiz_cell_div_mitosis_quiz_pool_q6," What stage of division is this cell in? Anaphase Yes! In anaphase, the sister chromatids are separated and are moving to the poles."
cell_repro_and_genetics,cell_div_mitosis_quiz_cell_div_mitosis_quiz_pool_q7,The centrosome disappears and the nuclear envelopes form in what stage of mitosis? telophase Yes _ In telophase the centrioles disappear and the nuclear envelopes reform.
cell_repro_and_genetics,cell_div_mitosis_quiz_cell_div_mitosis_quiz_pool_q8,"In what stage are sister chromatids separated and pulled to opposite sides of the cell _ anaphase Yes, that's correct _ In anaphase, the sister chromatids separate."
cell_repro_and_genetics,inline_meiosis-1_asexual_cell_division_q1,What is the name of the process of asexual cell division that results in daughter cells that are identical to the parent cell? Mitosis Correct _ Mitosis is the cell division that results in two identical daughter cells _ Cell division is part of the cell cycle _ Somatic cells and germ cells reproduce asexually _ Somatic cells undergo mitosis.
cell_repro_and_genetics,inline_meiosis-1_asexual_cell_division_q2,What is the name of the process of sexual cell division that results in daughter cells that are NOT identical to their parent cell? Meiosis Correct _ Meiosis does not result in identical daughter cells _ Cell division is part of the cell cycle _ Somatic cells and germ cells reproduce asexually _ Somatic cells undergo mitosis.
cell_repro_and_genetics,inline_meiosis-2_sex_vs_asex_DIGT_q1,"The main advantage of sexual reproduction compared to asexual reproduction is that it produces: more genetic variation among offspring _ Correct _ Sexual reproduction increases the genetic variation of the offspring _ Think carefully about the qualities of sexual vs _ asexual reproduction _ Do you think you’d have more chances to win a lottery with many identical tickets, or with fewer, but more variable, tickets? Remember, sexual reproduction produces fewer, more genetically diverse babies."
cell_repro_and_genetics,inline_meiosis-2_sex_vs_asex_DIGT_q2," A hypothetical cell has a chromosome number of 2n = 16 _ Which of the following statements is TRUE? The diploid cells from this species have 8 homologous pairs of chromosomes _ Correct _ The cell has 2n = 16 chromosomes, so n = 8 _ This means the cell has 8 different chromosomes, but has 2 copies of each _ “N” refers to the number of chromosome sets in a cell _ In diploid cells (2n), chromosomes are in pairs."
cell_repro_and_genetics,inline_meiosis-3_mitosis_vs_meiosis_LBD_q1,"What stage of mitosis is represented? Metaphase Correct _ During metaphase, chromosomes line up in the middle of the cell _ The chromosomes are lined up at the middle of the cell _ The stage of mitosis shown here follows prophase."
cell_repro_and_genetics,inline_meiosis-3_mitosis_vs_meiosis_LBD_q2," This cell is identical to the one going through mitosis _ False Correct _ This cell does not look the same as the cell in metaphase of mitosis _ In this image, homologous pairs of chromosomes are aligned next to each other _ In mitosis, chromosomes are randomly aligned along the metaphase plate _ "
cell_repro_and_genetics,inline_meiosis-3_mitosis_vs_meiosis_LBD_q3," The homologous chromosomes in this cell are hooked to each other _ True Correct _ See how the two big chromosomes are stuck together? See how the two little chromosomes are stuck together? In this image, homologous pairs of chromosomes are aligned next to each other."
cell_repro_and_genetics,inline_meiosis-3_mitosis_vs_meiosis_LBD_q4, The homologous chromosomes in this cell are lined up on the metaphase plate _ True Correct _ See how the homologous pairs are lined up in the middle of the cell? The metaphase plate runs along the middle of the cell.
cell_repro_and_genetics,inline_meiosis-3_mitosis_vs_meiosis_LBD_q5,"What is different about the second cell? In the first cell, the chromosomes are all one color _ In the second cell, the chromosomes have more than one color _ Correct _ In the second cell, crossing over occurred and the homologous chromosomes swapped DNA _ Look at the color of the chromosomes."
cell_repro_and_genetics,inline_meiosis-5_daughter-cells_LBD_q1,"Examine the cell images above _ How many total chromosomes are there in the cell BEFORE meiosis I? 4 Correct _ There are four chromosomes in the original cell _ The cell on the left is before meiosis I _ The two cells on the right are at the end of meiosis I, about to enter meiosis II _ Count the number of centromeres in each cell to determine the number of chromosomes _ Remember, centromeres are where sister chromatids attach _ The cell on the left has four centromeres"
cell_repro_and_genetics,inline_meiosis-5_daughter-cells_LBD_q2,"How many chromosomes are there in each cell AFTER meiosis I? 2 Correct _ If you count the centromeres, you’ll see that now there are two chromosomes in each cell _ The number of chromosomes in the cell was cut in half _ This is why meiosis I is called the “reduction division.” The cell on the left is before meiosis I _ The 2 cells on the right are at the end of meiosis I, and about to enter meiosis II _ Count the number of centromeres in each cell to determine the number of chromosomes _ The cells on the right each have two centromeres."
cell_repro_and_genetics,inline_meiosis-8_importance_DIGT_q1,Meiosis is important for sexual reproduction in all of the following ways except? Maintaining proper function of the germ cells Correct _ Germs cells produce gametes (egg and sperm) through meiosis _ Meiosis does not maintain the function of the germs cells _ Maintaining the proper functioning of germ cells is the job of hormones.
cell_repro_and_genetics,inline_meiosis-6_telophase_LBD_q1,"After telophase I of meiosis, the chromosomal makeup of each daughter cell is: haploid, and the chromosomes are each composed of two chromatids _ Correct _ Homologous pairs separate in anaphase I, but sister chromatids don’t separate until anaphase II _ When do the homologous pairs separate? Meiosis II is very much the same as mitosis _ Chromosome pairs separate during meiosis I, and sister chromatids separate during meiosis II."
cell_repro_and_genetics,inline_meiosis-6_telophase_LBD_q2_nbr_chromosomes," At the end of telophase II, the number of chromosomes is 1N (haploid) Correct _ At the end of meiosis, the daughter cells are haploid and contain one copy of each chromosome _ The parental cell was diploid and had two copies of each chromosome."
cell_repro_and_genetics,inline_meiosis-6_telophase_LBD_q3_genetic_variability," Meiosis and sexual reproduction produce genetic variability in all of the following ways except? Producing identical daughter cells Correct _ Identical daughter cells are produced in mitosis and since they have identical genes and chromosomes, this does not increase genetic diversity."
cell_repro_and_genetics,inline_meiosis-6_telophase_LBD_q4_chromatids_separated, In which stage of meiosis are sister chromatids separated? Anaphase II Correct! Sister chromatids are separated during anaphase II of meiosis _ 
cell_repro_and_genetics,inline_meiosis-7_non-disjunct_DIGT_q1,"Select the answer which best describes nondisjunction: Nondisjunction is the unequal division of the genetic material during cell division, and it leads to a missing chromosome or an extra chromosome _ Correct _ The unequal separation of homologous chromosomes results in cells with more or less chromosomes than normal _ Nondisjunction means that chromosomes or sister chromatids don’t move to the proper poles of the cell during cell division _ Normally, each cell should end up with the same number of chromosomes _ Nondisjunction is an error in this process."
cell_repro_and_genetics,cell_division_meiosis_quiz_cell_division_meiosis_quiz_pool_q1,What is the purpose of meiosis? To enable an organism to produce gametes Yes _ Meiosis results in haploid gametes for sexual reproduction
cell_repro_and_genetics,cell_division_meiosis_quiz_cell_division_meiosis_quiz_pool_q2,Which of the following tasks is accomplished through the process of meiosis? Production of sperm or eggs Yes _ Meiosis results in sperm or egg production.
cell_repro_and_genetics,cell_division_meiosis_quiz_cell_division_meiosis_quiz_pool_q3,Homologous chromosomes separate and are pulled to opposite sides of the cell during what stage of cell division? (Read each option carefully.) Anaphase I of meiosis Yes _ Homologous chromosomes are separated and pulled to opposite sides of the cell during Anaphase I.
cell_repro_and_genetics,cell_division_meiosis_quiz_cell_division_meiosis_quiz_pool_q4,Crossing over occurs between homologous chromosomes during what stage of cell division? (Read each option carefully.) Prophase I of meiosis Yes _ Homologous chromosomes hook up and crossing over occurs during prophase I of meiosis.
cell_repro_and_genetics,cell_division_meiosis_quiz_cell_division_meiosis_quiz_pool_q5,"Mitosis results in _ cells and meiosis results in _ cells _ diploid, haploid Yes _ Mitosis results in diploid cells and meiosis results in haploid cells."
cell_repro_and_genetics,cell_division_meiosis_quiz_cell_division_meiosis_quiz_pool_q6,"Mitosis results in _ and meiosis results in _ _ somatic cells, gametes Yes _ Mitosis results in somatic cells and meiosis results in gametes."
cell_repro_and_genetics,cell_division_meiosis_quiz_cell_division_meiosis_quiz_pool_q7,A child with Down Syndrome has 3 copies of chromosome 21 (trisomy 21) _ Which statement could be true in regards to this child? All these answers could be true _ Yes _ All of these answers could be true.
cell_repro_and_genetics,cell_division_meiosis_quiz_cell_division_meiosis_quiz_pool_q8,What advantage does sexual reproduction have over asexual reproduction? Sexual reproduction provides more genetic variability Correct _ Asexual reproduction produces identical copies (unless a mutation occurs); sexual reproduction produces variability.
cell_repro_and_genetics,cell_division_meiosis_quiz_cell_division_meiosis_quiz_pool_q9,Corn has 20 chromosomes _ When corn undergoes meiosis how many chromosomes are found in the gametes? 10 Correct _ Meiosis results in half the number of chromosomes.
cell_repro_and_genetics,cell_division_meiosis_quiz_cell_division_meiosis_quiz_pool_q10,Cats have a diploid number of 38 _ How many chromosomes are in a cat egg? 19 Correct _ Haploid cells have half the number of chromosomes as diploid cells.
cell_repro_and_genetics,genetics_heredity_chromosome_digt_q1,Which of the following contains the largest amount of genetic information? chromosome Correct _ A single chromosome contains many genes.
cell_repro_and_genetics,genetics_heredity_chromosome_digt_q2, Fur color in dogs is an example of a(n): phenotype Correct _ Visible traits are called phenotypes.
cell_repro_and_genetics,genetics_heredity_chromosome_digt_q3, The genes that encode the brown pigment in a dog’s fur are an example of a(n): genotype Correct _ The genotype is the genetic makeup that results in various fur colors _ The genotype describes the genes which an organism has _ 
cell_repro_and_genetics,genetics_heredity_chromosome_digt_q4," The genes, which encode for the pigments for brown and black fur are located in the same spot on the same chromosome _ Brown and black genes are examples of a(n): allele Correct _ Alleles are variations of a gene; which specific alleles a genes has makes up its genotype _ A dog can either have the brown or black gene on at this spot on the chromosome _ The brown and black genes are alleles _ "
cell_repro_and_genetics,genetics_heredity_heteroxygous_digt_q1,A cell that has two different alleles of the same gene is called heterozygous Correct _ A heterozygous cell has different versions of a gene _ This cell has two different versions of a gene _ One of these words includes the root for “different.”
cell_repro_and_genetics,_u3_cell_structure_functions_DIGT_q1,What is the function of the ribosome? The ribosome builds proteins using the information contained in DNA _ Correct _ The ribosome builds proteins.
cell_repro_and_genetics,_u3_cell_structure_functions_DIGT_q2, Which structure stores genetic information? chromosomes/DNA Correct _ Genetic information for eukaryotes and prokaryotes is stored within the chromosomes/DNA.
cell_repro_and_genetics,genetics_heredity_cells_LBD_q1,This cell is: heterozygous Correct _ This cell is heterozygous for this gene because it has two different versions of the gene _ Notice that this cell has two different versions of the gene _ The root “hetero” means different.
cell_repro_and_genetics,genetics_heredity_cells_LBD_q2,"Prior to meiosis, the cell must go through the “S” stage of the cell cycle _ What happens during this stage? DNA is copied _ Correct _ The DNA is copied in the S stage of the cell cycle _ “S” stands for ""synthesis,"" which means building _ Prior to dividing the chromosomes, they must be replicated."
cell_repro_and_genetics,genetics_heredity_cells_LBD2_q1,"How many cells are present after meiosis I? 2 Correct _ Meiosis I produces two cells _ Meiosis has two stages; this question is asking how many cells are present after meiosis I only _ Meiosis I is only halfway through the process of meiosis and would have produced half the total number of cells _ Although meiosis results in four cells, meiosis I is only halfway through the process and has only produced half the total number of cells."
cell_repro_and_genetics,genetics_heredity_meiosis_lbd_q1,"After meiosis I, these cells will enter meiosis II _ How many cells are present after meiosis II? 4 Correct _ Each of the two cells divides again to produce four total cells _ Each of the cells from meiosis I divides again in meiosis II _ Meiosis I ends with two cells, each of which divides again."
cell_repro_and_genetics,genetics_heredity_meiosis_digt_q1,"The original cell in this example was heterozygous, so its genotype is: Aa Correct _ This cell has two different alleles _ A genotype is the genetic information in a cell _ The genotype of a diploid cell needs to include both alleles of a gene _ This cell has two different alleles of this gene."
cell_repro_and_genetics,genetics_heredity_meiosis_digt_q2,How many gametes does a diploid cell make during meiosis? four haploid cells Correct _ Meiosis produces four haploid cells _ Meiosis produces cells with half the number of chromosomes as the original cell _ The original cell was diploid _ Meiosis produces four cells.
cell_repro_and_genetics,genetics_heredity_meiosis_digt_q3,"What percentage of the gametes produced will have the “A” allele? 50% Correct _ Two of the four cells have this allele _ Review the images above; how many of the cells have an “A”? Of the four cells above, two have an “A,” and two have an “a.”"
cell_repro_and_genetics,genetics_heredity_meiosis_digt_q4,"What percentage of the gametes produced will have the “a” allele? 50% Correct _ Two of the four cells have this allele _ Review the images above; how many of the cells have an “a”? Of the four cells above, two have an “A,” and two have an “a.”"
cell_repro_and_genetics,genetics_heredity_meiosis_digt_q5,"Now, consider a cell that is homozygous _ Which of the following genotypes would be a potential genotype for this cell? (More than one answer is correct.) AA Correct _ A cell that is AA is homozygous _ Homozygous cells have two of the same alleles of a gene."
cell_repro_and_genetics,genetics_heredity_meiosis_digt_q6,Consider a cell with the aa genotype _ What percentage of the gametes produced will have the “a” allele? 100% Correct _ This cell can produce only gametes with the “a” allele.
cell_repro_and_genetics,genetics_heredity_flowers_LBD_q1,"In this case, “flower color” is the trait Correct _ A trait is a distinguishing feature that can have different forms."
cell_repro_and_genetics,genetics_heredity_flowers_LBD_q2,What do the phrases “purple flower” and “white flower” refer to? phenotype Correct _ Phenotype is the physical appearance of a trait.
cell_repro_and_genetics,genetics_heredity_heterozygous_text_q1,What is the term for having different alleles for a certain trait? Correct.
cell_repro_and_genetics,genetics_heredity_heterozygous_text_q2,What is the term for having the same alleles for a certain trait? Correct.
cell_repro_and_genetics,genetics_heredity_flowers_LBD3_q1,"Let’s call the allele responsible for the purple color ""B."" What would be the genetic makeup (genotype) of a purple flower somatic cell considering only the trait for flower color? BB Correct _ A somatic cell is diploid, as it contains the genes from the two parents _ Because they are true-breeding, both alleles are the same coding for the purple color."
